,index,walk_id,title,summary,lat,lng
0,0,1,Fairhaven Surf Life Saving Club,Fairhaven is a well known surf beach. The beach is patrolled during December to the Easter. The Fairhaven SLSC was established in 1958.,-38.46875894,144.08445884
1,1,1,Beach walk,"From Sprout Creek, Eastern View, Moggs Creek, Fairhaven to the bottom of the light house there is approx 6 km of beach, featuring rolling surf and spectacular views of the Otway Ranges and Lorne.",-38.46854155,144.08969344
2,2,1,Rock pools,"See what sort of shells and stones you can collect. Can you find a bright red sea star? You can see all sorts of sea vegetation, small fish and crabs. Look at the bird life, gulls and cormorants.",-38.4684592,144.09241977
3,3,1,Sand dunes,The beautiful rolling sand dunes shape the beach. 2011 has seen significant erosion due to winter storms that have bought strong winds and big waves (up to 10 feet).,-38.46841795,144.09531794
4,4,1,Painkalac Creek,The creek separates Aireys Inlet from Fairhaven and forms an inlet behind the sand dunes before it cuts through to the ocean. A great place to shelter from the wind and for younger children to swim.,-38.46838956,144.09731206
5,5,1,Rocks and caves under the light house,There are more rockpools and rocky outcrops to explore under the light house. This area is part of the marine national park. This means that all wildlife is protected and cannot be removed.,-38.46882153,144.10086059
6,6,1,Aireys Inlet playground and picnic ground,There is small skateboard ramp for children to ride their scooters or skateboards. There are also swings and other play equipment for children and a picnic area.,-38.46619881,144.09877169
7,7,1,Aireys Inlet lower shops,"Pick up a coffee, newspaper or Fish and Chips! To the left of the shops, on the other side of the river, kangaroos can be seen in the early morning or at dusk.",-38.46553592,144.09880054
8,8,1,Loutit Bay lookout,Return to Painkalac Creek inlet and walk to the grassed area on the left. At the light house bollard turn right and walk up the signed (steep) walking track. Enjoy panaromic views on your walk up.,-38.46791596,144.10343538
9,9,1,Historical homestead and building,At the lighthouse is the original homestead for the lighthouse keeper. The Aireys Inlet area was first settled in the 1840s. The first tourists arrived in 1919.,-38.46804821,144.10383193
10,10,1,Split Point Lighthouse,Follow the signs and continue up the walking track. Shipping along the Victorian coast was much safer once the combination of this and other lighthouses at Cape Otway and Point Lonsdale were built.,-38.46811382,144.10402869
11,11,2,1. Tramway signal box,"Built in 1928 soon after the electrification of the Swanston St and St Kilda Rd cable tramways. Originally included female public toilets, roofed passenger waiting area, small store and staff toilets.",-37.80695293,144.96281264
12,12,2,2. City Baths,"Built in 1903, the design reflected the social conventions of the time. Men and women were segregated for all facilities; second class baths were in the basement, first class on the main floor. ",-37.80738194,144.96299006
13,13,2,3. Magistrates Court,"Built on the site of the earlier Supreme Court, the building retains fittings from the earlier court including the Gothic canopy that judge Sir Redmond Barry sat under during Ned Kelly trial in 1880.",-37.80882759,144.96611185
14,14,2,4. Old Melbourne Gaol,"Built between 1851 - 1864. As the oldest surviving penal establishment, it was the site where Ned Kelly was imprisoned, executed and buried, amongst many other criminals.",-37.80756873,144.96571024
15,15,2,5. Eight Hour Day Monument,"Built in 1923, the monument commemorates the Eight Hour Day movement started by stonemasons in 1856 to improve working conditions - eight hours labour, eight hours rest and eight hours recreation.",-37.8071259,144.965808
16,16,2,6. Trades Hall,"Built in stages from 1873 - 1926, Trades Hall is of historical and social significance as a centre of radical and working class politics and activism in Victoria for over 100 years.",-37.80690503,144.96598933
17,17,2,7. Medley Hall,"Built in 1893 as a private residence, the building has since housed the Italian Club, Italian Consulate and for short time was used for a 'less reputable purpose'. ",-37.80580276,144.96761773
18,18,2,8. Lygon shop corner,Lygon Buildings is architecturally significant as the largest and most intact terrace of nineteenth century shops in Melbourne. There are no other comparable retail structures in Melbourne.,-37.80486328,144.96627867
19,19,2,9. Matthais House,"A two storeyed stucco faced bluestone house of 1865-6 with many charming and unusual features - a tower and weathervane, a cantilevered cast iron balcony and delicately glazed arched windows.",-37.80382667,144.96775921
20,20,2,10. Sacred Heart Catholic Church,"Built in 1855-56. In the 1930s and 1940s the Church of the Sacred Heart became a primary focus for Carlton's Italian community, and this continued into the 1960s.",-37.80305114,144.96937767
21,21,2,11. IMAX Theatre,"IMAX is the world's largest cinema format, with a screen up to eight storeys high. Films, from documentaries to latest release movies, can be experienced in 2D or 3D.",-37.80337052,144.96961626
22,22,2,12. Melbourne Museum,"The museum has eight galleries, including one just for children. Highlights include a complete skeleton of a blue whale, the Bunjilaka Aboriginal Cultural Centre, a living rainforest and Phar Lap.",-37.80367352,144.96956388
23,23,2,13. Royal Exhibition Building,The Royal Exhibition Building is the only surviving Great Hall that once housed a 19th-century international exhibition and is still used for exhibitions. ,-37.80513488,144.97123539
24,24,2,14. Carlton Gardens,"Developed in 19th-century Gardenesque style, the Gardens feature symmetrically-placed garden beds, significant avenues, the path system, specimen and clusters of trees, 2 small lakes and 3 fountains.",-37.80562954,144.97138546
25,25,2,15. Playground,"Wonderful playground with swings, slides and many opportunities to climb and clamber, plus small hills to roll down!",-37.80250522,144.97069999
26,26,2,16. Carlton Gardens Primary School,The school is an Italian Gothic style building built in 1884 with a hipped roof central pavilion buttressed either end by slightly projecting gables.,-37.80193764,144.96962474
27,27,2,17. Terrace Houses (201 - 205 Drummond Street),"Built in 1884, Holcombe Terrace is a fine example of boom style terrace architecture and notable among the works of Norman Hitchcock.",-37.80089591,144.96833986
28,28,2,18. Museo Italiano,"Museo Italiano displays and interprets the experience of Italian migration, and the culture created by Italians in Australia.",-37.79881302,144.96813606
29,29,2,19. La Mama Theatre,"Built in 1883, the building was used for various industrial purposes. In 1967, it was leased by Betty Burstall, teacher and theatre-lover, for use as a small theatre to nurture new Australian drama.",-37.79875344,144.96765164
30,30,2,19. Underground public toilets,"The underground public toilets, built in 1939, are one of eleven built in Melbourne in response to public demand for public toilet facilities in Melbourne that were both sanitary and discreet.",-37.7987245,144.9674163
31,31,2,21. 313-315 Drummond Street,"Built in 1889, the buliding is architecturally significant for its highly unusual grotesque Gothic facade. The kangaroo-gryphon grotesques on the parapet are highly unusual and distinctive.",-37.79842454,144.9687503
32,32,2,22. Carlton Court House,The Carlton Court House is historically significant as part of the civic core of Drummond Street. It is directly opposite the 1878 Carlton Police Station. ,-37.79770339,144.96886656
33,33,3,The Mildura Wharf,Mildura Wharf has been a vital part of the town and inland river transport system since the 1880s. It was established by the Mildura Progress Committee in 1888 to assist the burgeoning river trade.,-34.1831733,142.16634149
34,34,3,Railway overpass,A short walk across the railway overpass leads to Deakin Ave or head left down to the Hugh King Drive underpass to avoid the stairs.,-34.18308684,142.16521185
35,35,3,Prince and Princess of Wales Fountain Plaza,This fountain is very special as it was opened by the Prince and Princess of Wales on the 29th October 1985. Many Mildura residence crowded around to see the Princess Diana.,-34.18332571,142.16467286
36,36,3,War Memorial ,"To the left is a War Memorial commemorating those who served in Vietnam, Korea
and South East Asia.",-34.18334912,142.16461225
37,37,3,"Sculpture commemorating Alfred Deakin, Primie Minister of Australia and the initiator of the Mildura",Sculpted by Michael Meszaros and presented to the city to mark the centenary of the irrigation colony in 1987. The memorial represents  fruit blocks and irrigation channels as seen from the air. ,-34.1833602,142.16458121
38,38,3,The Grand Hotel (to the right),"Enter the Grand Hotel’s main entrance and turn left. To your right, you will see a display of historical photos. Through the glass doors are one of Mildura’s original Chaffey fountains.",-34.18351713,142.1641636
39,39,3,Commodore Motel former site of the Warren boarding house,"Back in 1888, this site was a early boarding house called the Warren. A plaque marking the site can be found at the entrance to the motel’s restaurant. The Warren was demolished in 1965.
",-34.18392536,142.16451843
40,40,3,WIN TV,"Originally STV8, opening in 1966 and next door is the Sunraysia Daily, the local newspaper.
",-34.184552,142.16377931
41,41,3,The Cultivator,"Mildura’s earliest newspaper was the Cultivator, begun in 1888. It was a
twice-weekly publication that moved to the current Sunraysia Daily site at
22 Deakin Avenue in 1912.",-34.18457895,142.16374769
42,42,3,Sunraysia Daily,"Local identity, C.J De Garis bought The Cultivator along with the Mildura
Telegraph and Merbein Irrigationist and merged them into one paper, the
Sunraysia Daily, in 1920.",-34.18459018,142.16373453
43,43,3,George and William Chaffey Building,"Across the road is a single story late Victorian, red brick building, with
a brick and iron palisade fence. The building was gifted to La Trobe Uni in 2009 by Don Carrazza.",-34.18467124,142.16363945
44,44,3,Electric Supply Department Substation No.1,"In the centre plantation, stands the Electric Supply Department Substation No.1, dating back to 1936, when the production of electricity was considered a local responsibility, rather than a state one.",-34.18488305,142.16339103
45,45,3,"Queen Elizabeth II visit to Mildura, March 25th, 1954","When Queen Elizabeth toured Mildura in 1954, a decorative dais was erected in this area of the plantation.  Pics of this day are displayed at the Carnegie Centre. Visit to Barclays Block in Red Cliffs",-34.18503122,142.16321607
46,46,3,"Bowring's Store, corner Deakin Avenue and 8th Street - Circa 1937","The site of the ANZ Bank was previously known as Bowring Corner and was the site of Bowring’s Store, opened in 1888. It extended into Langtree Avenue in 1961 but ceased business two decades later.
",-34.18505972,142.16272952
47,47,3,Old Mildura Post Office (LHS of Deakin Ave),"This corner building was for over a century, the Mildura Post Office. The earliest Post Office on this site was built in 1890, with much of the current building being erected in 1923. ",-34.18539044,142.1627847
48,48,3,George V Memorial Fountain (in centre plantation),"Crossing into the centre plantation, you will find the George V Memorial Fountain, originally erected in the gardens of the Rio Vista, home of W.B Chaffey, it was moved to its current position in 1936",-34.18544392,142.16272763
49,49,3,Mildura Law Courts (LHS of Deakin Ave),"Opened by Robert Hulls, Victoria’s Attorney General, on Nov 23 2004. This complex was built on the site that began as Washington Stores, before becoming Maples, before it all went up in flames in 1996",-34.18576121,142.16236065
50,50,3,70 Deakin Avenue (LHS of Deakin Ave),"Once the site of the Shire Offices, beginning as a modest, timber, two roomed building before the current building was erected in 1922. In 1971, the Shire Offices were relocated to Irymple. ",-34.18614633,142.16188736
51,51,3,Carnegie Centre - Home to the Historical and Genealogical Societies (LHS of Deakin Ave),"Constructed in 1908, as the Carnegie Library, courtesy of a 2000 pound grant made by Andrew Carnegie, in 1906, after a request from Lord Hopetoun. The tower was added in 1922 as a soldier memorial.",-34.186245,142.16176521
52,52,3,Civic Buildings  (LHS of Deakin Ave),"The Civic Buildings, opened in 1958 and it’s also the site of the original Shire Hall, also known as the Mildura Town Hall.",-34.18656212,142.16137632
53,53,3,Statue of W.B. Chaffey (in center  plantation),"In the center  plantation is a statue of W.B. Chaffey, who died in 1926. The Paul Mountford sculpture was unveiled in 1929. A similar sculpture can be found in Renmark, SA. ",-34.18670405,142.16120554
54,54,3,Desailly Rotunda (in center  plantation),"The centre  plantation is home to the Desailly Rotunda, named for Cr George Desailly, former Shire President, who died whilst in office in 1913.",-34.18660603,142.16132206
55,55,3,61 Deakin Ave - Mildura's earliest surviving building (RHS of Deakin Ave),"On the RHS of Deakin Ave is the earliest surviving building in Mildura. It started out as Mildura’s first general store, owned by H.B Williams, in 1887. A bank altered the building appearance in 1937.",-34.18604765,142.1620095
56,56,3,69 Deakin Ave (RHS of Deakin Ave),"Built in 1914, this  Edwardian building has been a restaurant, a bank, a real estate agency and other businesses, which although altered over the years, still retains some of its original charm.
",-34.18629834,142.16170105
57,57,3,Mildura Club (RHS of Deakin Ave),"The Mildura ""Gentlemen's Club"" began in 1890 with Lord Ranfurly as the first President. Meetings were originally held at the Coffee Palace, until this building was completed in 1920. ",-34.18682464,142.16109258
58,58,3,Deakin Cinema Complex  (RHS of Deakin Ave),"The Deakin Cinema complex was  established in 1975. A point of interest is that the cinema includes the original site of the Masonic Temple, built in 1907, with the façade still remaining. ",-34.18717927,142.16062025
59,59,3,Mildura Workingmans Club (LHS of Deakin Ave),"An iconic landmark, once famous for having the world’s longest bar (which was removed in recent renovations.). Begun in 1908, it was originally a 1 story structure with a 2nd level added in 1935. ",-34.18744262,142.1602677
60,60,3,Mildura Workingmans Club  War Memorial (LHS of Deakin Ave),"Has stood at the front of the club, since 1920, honoring Mildura’s war dead. The marble soldier is the work of A.D Thomson and the three-sided list of soldiers’ names underpins the heavy losses of WW1",-34.18746532,142.16024187
61,61,3,Methodist Church (LHS of Deakin Ave),"Opened in 1912, this unique church had a number of architectural influences, including Byzantine, Queen Anne, Masonic and Art Nouveau . Image: Methodist Church under construction 1911.",-34.18831339,142.15927694
62,62,3,The Church of Christ  (RHS of Deakin Ave),"Built in 1908, the Church of Christ was first organised by Reuben Mansell in 1890 and members met in a variety of venues until this building was completed using all voluntary labour. ",-34.18787876,142.15878865
63,63,3,War Memorial (centre plantation),Commemorates those who died or were killed in World War One. Erected by the Mildura Branch R. S. & S. I. L. A.,-34.18839149,142.15819056
64,64,3,Uniting Church / St Andrew’s  (RHS of Deakin Ave),"The Uniting Church, known as St Andrew’s, started out as a Presbyterian church and was built in 1914, at a cost of 2097 pounds. It replaced a wooden structure that had been there since 1891. ",-34.18920549,142.15729784
65,65,3,St Margaret’s Anglican Church (LSH of Deakin Ave),"This church opened in 1902, with the addition of the sanctuary in 1934 and the vestry and bell tower in 1957 that honours the lost soldiers of World War II.",-34.18952039,142.15768978
66,66,3,Madden Avenue ,"Madden Ave was originally planned to be the principal retail district of Mildura due to easy access to the wharf. However,  Langtree, with it’s proximity to the railway proved to be more significant",-34.19026169,142.15861732
67,67,3,Mildura RSL Sub Branch,"The Returned and Services League with some 1500 Sub Branches Australia wide and with a membership of 240,000 is the largest service association in Australia.",-34.18913686,142.15997189
68,68,3,Mildura Water Tower,"As you cross over 10th street, to your right you will see one of  Mildura's Water Towers. Built in 1957, the tower provides water pressure for thousands of homes across the urban area.",-34.18891499,142.16024011
69,69,3,Mecure Hotel ,"Commercial Hotel, commonly remembered as the Wintersun and now the Mecure Hotel was built in 1925",-34.18593745,142.16383964
70,70,3,Disused water tower,"Behind the hotel is a disused water tower, which from 1912 until 1957 operated as Mildura’s sole source of water storage. Instigated by the former First Mildura Irrigation Trust. 180000 litre capacity",-34.18570226,142.16412395
71,71,4,Under the Clocks,Melbourne's well known and iconic meeting place is under the clocks at Flinders Street Station. Sit on the steps and see the world go by. ,-37.81775223,144.96721165
72,72,4,Mirka Mora mosaic,"Mirka Mora made this mosaic in about 1985, it is brilliant. Do not be one of the thousands who walk past it every day without stopping. ",-37.81867716,144.9678153
73,73,4,To Birrarung Marr,"The slope down to Birrarung Marr, always fills with expectation. The sculpture of hundreds of red poles is a cracker. Go up and push the poles firmly, what a noise!",-37.81862957,144.96835377
74,74,4,Federation Square,"There always seems to be something happening at Fed Square whether it is concerts, buskers, festivals or people lolling about. The pavers are great to sit on on a sunny afternoon. ",-37.81803095,144.96819109
75,75,4,The Art Centre from Fed Square,Looking over to the Art Centre spire from Fed Square.,-37.81826778,144.96948266
76,76,4,Birrarung Marr playground,"The playground is always open. Watch kids play and enjoy the tube slides, sand pits, swinging hammocks, activity panels, rock and rope climbing features and balance beams.",-37.81817384,144.97133444
77,77,4,Art Play,Art Play is a great place for children it has lots of shows and creative activities for kids.,-37.81842082,144.97142583
78,78,4,Mosaic outside art play,"I do not know what the story is behind this brightly coloured mosaic outside Art Play, but it is wonderful. ",-37.81843198,144.97162369
79,79,4,Textured path,"The winding, textured pathway of cast iron acknowledges the significance of the eel as a traditional food source for groups camped by the river.",-37.81842658,144.971528
80,80,4,Watching rowers from Birrarung Marr,Sit on the seats under a shady tree watching rowers go by.,-37.81861151,144.97173697
81,81,4,To Princes Bridge,The gravel path on the river bank is a bit quieter. More seats and looking back to Princess Bridge. ,-37.8186351,144.97185557
82,82,4,West along the river,From 'Angel' you can get a good look along the Yarra River ,-37.81896412,144.97277994
83,83,4,Angel,"Angel (ceramic, steel and concrete) by Deborah Halpern is an artwork commissioned by the National Gallery of Victoria. It is even more impressive than the photo suggests. ",-37.81895244,144.97301726
84,84,4,Grassy hill for rolling,There should be more grassy hills like this one in the centre of cities. Watch the number of kids who are immediately drawn to it and roll down laughing.,-37.81803458,144.97380556
85,85,4,Walking up the slope to the bridge,The trees and shrubs set in the stone fence as you walk up the slope to the William Barak bridge. ,-37.81848684,144.97440371
86,86,4,William Barak bridge,"A purpose built walking (and cycling) space, William Barak bridge is one of true delights of Melbourne. Beautiful and functional.   ",-37.81832709,144.97679175
87,87,4,Listening to Proximities,"Proximities is a public art installation commissioned for the 2006 Commonwealth Games.  The stories and songs from 53 Commonwealth nations come out of the many, many speakers across the bridge. ",-37.81834507,144.9769408
88,88,4,Sit and watch Melbourne,Sit on the bridge and look south to the Yarra and Tennis Centre or north to the city and listen to the trains go by underneath.,-37.81840969,144.97780994
89,89,4,Off the bridge to the 'G',Coming off the bridge and walk to the MCG under the shade of magnificent old Elm trees.,-37.81866569,144.98000985
90,90,4,The MCG,"The MCG, what a collosseum. You don't realise how massive it is until you actually see it. Even if you don't like sport, the sound of the crowd cheering will grab your attention.",-37.81885613,144.98111314
91,91,4,Dennis Lillee,"Bronze statues do around the MCG, none more impressive than the great Dennis Lillee.",-37.81904332,144.98187585
92,92,4,Aussie Rules,Statue commemorating the first game of Australian Rules Football said to be played nearby on 7 August 1858.,-37.81880752,144.98220433
93,93,4,Jolimont Station,Its a beautiful the old train bridge. Catch a train (or tram) back to Flinders St or keep going. ,-37.81648432,144.98350297
94,94,5,Watt's Cottage,"Home to early settlers in Sorrento, this house was built in 1869. The Pioneer Memorial Garden is well tended with blooms all year round. Tours available (at limited times).",-38.34054845,144.73584164
95,95,5,Information boards and cafe,"Check out the information boards here for details about the history, local environment and features of the area. All Smiles Cafe located a short walk away from here.",-38.34551199,144.72681889
96,96,5,Surf's up,"A good spot to watch the surf, have a picnic, go for a swim, read a book or do whatever you please.",-38.34548235,144.72660135
97,97,5,Uphill climb towards the top,Definitely a steep climb uphill but the scenery from the top is very worthwhile. Get your heart rate up!,-38.34538353,144.72625773
98,98,5,Panoramic views,"A perfect spot to watch the sunset, or simply enjoy the sweeping panoramic views.",-38.34505623,144.72526604
99,99,5,Heading down to the beach,"Follow the track, which will eventually take you towards the beach.",-38.34316437,144.72111073
100,100,5,Fine sandy beach,Enjoy the salty sea breezes as you feel the sand under your feet on this beautiful stretch of coastline. ,-38.34156282,144.71668977
101,101,5,Portsea Surf Lifesaving Club,You can take a detour here if you need a toilet stop.,-38.33542809,144.70425765
102,102,5,'London Bridge',A great spot to explore the rockpools and wander under the 'London Bridge' (but not during high tide of course). You can continue along the beach all the way to Point Nepean if you like.,-38.33035347,144.69404522
103,103,5,Public toilets and drinking fountain,Phew! It's a pretty steep ramp that leads you up here. A convenient toilet stop and a chance to top up your water bottle before heading off again. ,-38.3295251,144.69499469
104,104,5,Start of Wilson's Folly Track,There's a sign a near the car park marking the start of the track. Apparently Capt R Wilson simply lit a match wherever he thought the bush needed to be cleared for the army\'s weapons training areas.,-38.32825967,144.69577002
105,105,5,Looking out to the sea,Listen out for the twitter of small birds in this fabulous bit of coastal bushland overlooking the sea.,-38.32624464,144.69165766
106,106,5,Unexploded bombs,"A former weapons training area. ""All large unexploded ordinance has been removed but you may come across small arms such as rifle and pistol shells,"" which of course, you shouldn't touch.",-38.32144469,144.69648537
107,107,5,Point Nepean Visitor Centre,The visitor centre has plenty of local information and maps of the area. You can take a tour to the historical Fort Nepean (a buggy can transport you there). Public toilets and BBQ available here.,-38.31870845,144.70297928
108,108,5,Mighty high fences,You can take a short detour down to the beach via Cove Ave. Clearly residents here like their privacy but it's such a shame that the street is marred by these enormously high walls and fences.,-38.31894485,144.70458036
109,109,5,Nature strip plantings,"Thankfully, there are patches of wonderful plants to enjoy as you walk down the street.",-38.31901562,144.70505969
110,110,5,A little bit arty,... and even a bit of art to give some of these high walls a little bit of character.,-38.3191189,144.70575917
111,111,5,On the other side,Across the road are a row of charming cottages that reminds us of how the area used to look before the high walls and fences came along.,-38.31923424,144.70654032
112,112,5,Bus stop,"You can catch bus number 788 back to Sorrento, or all the way back to Frankston along point Nepean Road. ",-38.31931725,144.70710254
113,113,6,Boardwalk near fishing platforms,The boardwalks starts along the path just past the carpark on Lakeside Drive. A few fishing platforms go off the boardwalk.,-37.54919735,149.7570991
114,114,6,Wetlands,"The inlet is on one side of the boardwalk and wetlands on the other, both have an abundance of birdlife and aquatic life.",-37.54939497,149.75700563
115,115,6,The shared path,The shared path is very popular with walkers and bike riders alike and is in pretty good condition.,-37.55145333,149.75589918
116,116,6,Pelicans and piers,There are many little jetties dotted along the path and it is hard not to spot a pelican or two perched on many of them.,-37.55366176,149.7536224
117,117,6,Raised boardwalks,The wonderful raised boardwalk provides a shady spot to look out to the inlet.,-37.55482476,149.75184366
118,118,6,Mallacoota harbour,"Old and new, big and small boats (but nothing too flash!) in the Mallacoota harbour.",-37.55666778,149.75451385
