,index,walk_id,title,summary,lat,lng
3331,3331,289,Tiny mushrooms,"Depending on the season, you might see a mushroom or two, clinging to a tree branch or nestled in the roots below.",-37.52681327,145.77312469
3332,3332,289,Return to Marysville,"At the end of the trail, you can visit Steavenson Falls and walk back to town the way you came. Enjoy the shade of the tall manna gums before the shorter tree ferns appear.",-37.52749396,145.77278137
3333,3333,289,New Life,"Once back in Marysville, see the 2011 sculpture titled, 'New Life' by local artist, Bruno Torfs. The dedication reads: 'to honour the past and embrace the future'.  Bruno has a sculpture garden too.",-37.53110153,145.7728672
3334,3334,290,Meteorite Park,Dedicated to a meteorite that fell over Murchison on the 28 Sept 1969. See the newspaper clippings from across the globe on display. Fragments of the meteorite are on display in museums around,-36.6163319,145.21631023
3335,3335,290,Gregorys Bridge Hotel,"Built 1865 and 1868, it was a country hotel, large general store and cellar with stables at the rear. The tree out front was planted in 1916 and is one of Victorias finest London Plane trees.",-36.61627496,145.22184234
3336,3336,290,"River bank gardens, boardwalk and three information lecterns","Discover Murchisons bygone era with images of the old streetscape, pub and paddle steamers. The boardwalk provides an impressive view of the Goulburn River.",-36.61684781,145.21824367
3337,3337,290,Goulburn River,"Saw its first paddle steamer in 1875. At the time Murchison had six hotels, two flour mills and numerous stores and services.",-36.61635645,145.21732242
3338,3338,290,Murchison Heritage Centre,Located out the side of the museum is a large pump that was used to pump water from the river for the townspeople. ,-36.61604561,145.21670878
3339,3339,291,Sparks Reserve ,"An open space with a playground, sitting area, dog poo bag dispenser and creek-side picnic spot",-37.77778739,145.0372392
3340,3340,291,"New path, connecting the Darebin Creek Trail with the Main Yarra Trail","Look left here to see the new path to the Main Yarra Trail, via Napier Waller Reserve.  This path is due to open to the public in 2017, though it is already well-trodden. ",-37.77905938,145.03672153
3341,3341,291,Bridge under Heidelberg Road ,"This terrific bridge joined Sparks Reserve with the Darebin Creek Trail, making life much easier for Fairy Hills residents wanting to walk along the creek.  ",-37.77877954,145.03586054
3342,3342,291,Flood-proof fencing,"The Darebin Creek floods regularly - to avoid fence losses, the owners of creek-side properties installed cable-based fencing with pivots with water flow. ",-37.7788071,145.03524497
3343,3343,291,A good spot to spot carp,"At the annual 'catch-a-carp' day, these pest fishes are sometime spotted here - though rarely caught.",-37.77816051,145.03483728
3344,3344,291,Hill stabilisation works ,"Build on an old tip, this hill is prone to slipping.  New stabilisation works and planting will keep the hill in place. ",-37.77675706,145.03485471
3345,3345,291,Ivanhoe Wetlands,"Look across to the Ivanhoe Wetlands - constructed in 1992, they are a haven for birds and wildlife.  You can reach them via paths and stepping stones further along the creek.  ",-37.7762737,145.03491908
3346,3346,291,Parklands entrance - and 're-bushing',Look to your right for where grass and weeds have been sprayed to make way for new planting - as part of an ongoing parkland-wide transition from grass to bush.,-37.77568008,145.03499955
3347,3347,291,Darebin Parklands map,"Just next to the path, this map shows the main walking and cycle routes through the parklands, as well as provision for dog-off leash areas and a number of historical markers.",-37.7756292,145.03492981
3348,3348,291,A spot for everyone - seats and nesting boxes,"As you stroll through the park, look up to see nest boxes for native birds and small animals - they are an ongoing project of the DCMC and DPA to help wildlife protect their young from predators.",-37.77559952,145.03561914
3349,3349,291,Path to the Ivanhoe Wetlands,"Follow this path to the right to find the stepping stones over the creek - then onto the Ivanhoe Wetlands, created in 1992.",-37.7755232,145.03496133
3350,3350,291,Mount Puffalo,"Mount Puffalo was created in 1998, and provides superb view of the park.",-37.77481085,145.0341171
3351,3351,291,Not just a duck pond,"Part of the parklands is built over a landfill, which 'leaches' liquid - a system on ponds, reed beds, waterfalls and wetlands clean and treats the water before it reaches the creek.",-37.77439532,145.03367454
3352,3352,291,Waterfall - aerating the water,"Lovely to look at and listen to, this waterfall plays a key role in the water treatment system - it aerates the water as it travels from one pond to another. ",-37.77414938,145.03334463
3353,3353,291,"Feeding the ducks - tempting, but discouraged","Ducks love bread, but it's not good for them - while you might not be feeding them much, please consider that you may be the tenth visitor today.",-37.77361512,145.03398836
3354,3354,291,On your bike!,"There are numerous shared trails through the parklands, though this one provides the easiest passage for wheels of all types.    ",-37.77378473,145.0337255
3355,3355,291,Spend some quality time with the ducks,"Seats like this one are dotted throughout the parklands, providing a rest stop and an opportunity to watch the water birds .",-37.77343703,145.03341973
3356,3356,291,Darebin Amphitheatre,"A perfectly placed amphitheatre, it is a popular spot for large family picnics, concerts and festivals.",-37.77295364,145.03316224
3357,3357,291,Brand new public toilets,"At the Separation Street entrance to the parklands, you'll find a car park and these brand new public toilets - clean, accessible and unisex. ",-37.77288791,145.03251448
3358,3358,291,Keep up to date with parklands happenings,"Want to know what's happening in the parklands?  You can check out the DPA Facebook - but if you're passing by, you're sure to find something interesting on this notice board. ",-37.77330134,145.03244206
3359,3359,291,Environment Centre - learn more and meet the rangers,"Home to the DCMC rangers and a place to learn about parklands history and management - pictured here, Ranger Pete has played a leading role in creation of the parklands over the past 25 years.   ",-37.77318473,145.032489
3360,3360,292,Kensington Neighbourhood House (KNH),"KNH runs various activities including vocational education, English language lessons, digital literacy, arts and crafts, social groups, weekend workshops and children's activities etc etc",-37.79325373,144.92782099
3361,3361,292,6th Melbourne Scouts,"6th Melbourne Scout Group has a proud 100 year history, and is the City of Melbourne’s only remaining Scout Group.",-37.79190735,144.92782652
3362,3362,292,Kumquat Tree,McCracken st is a delight. Many of the beautiful cottages have citrus trees and lavender bushes spilling out on to the sidewalk.,-37.79031339,144.92783132
3363,3363,292,Unnamed park. ,This park makes a lovely addition to the walk. Often there are warbling magpies to accompany you and there is a swing set and benches to enjoy the serenity.,-37.78916512,144.92807125
3364,3364,292,Kensington Town Hall,The Kensington Town Hall is a beautiful old building and an important civic space for the local community. ,-37.78924588,144.92922397
3365,3365,292,Pepper Cafe,"Pepper Cafe sits at the base of bustling Newmarket train station, on the popular shopping strip of Pin Oak Crescent in Flemington. ",-37.78711982,144.92927083
3366,3366,293,The HV McKay Rural Discovery Centre - Campaspe Run,"Elmore’s tribute to the Sunshine Harvester, early pioneers and the sheep and grain industries. Campaspe Run is home to Elmore’s Community Quilt and has a fabulous gift shop. Open 7 days a week.",-36.49533599,144.60753035
3367,3367,293,Overhead Railway Bridge ,The Overhead Bridge was opened on June 16 1928 (costing £454 to build) and removed Nov 24 1980. It was sold to the Elmore Progress Association and today links Campaspe Run and the EPA Museum.,-36.49517619,144.60749969
3368,3368,293,Elmore Railway Station Water Tower,"Built in 1870 to supply water to steam trains, the 18'x15' tower was made from locally made bricks. Water was pumped from the Campaspe River. The tower was donated to the EPA in 1972.",-36.49503579,144.60752013
3369,3369,293,Elmore Railway Station,"Opened 1870, originally named Runnymede Railway Station, the station was renamed Elmore Railway Station in 1876. The Queen travelled by train through Elmore on her 1954 tour.",-36.49494933,144.60758284
3370,3370,293,Elmore Progress Association (EPA) Museum,"Situated in the Railway Station Buildings, this volunteer run Museum is free and well worth a visit. Open Wednesdays from 9.30-2.",-36.49491649,144.60762626
3371,3371,293,Cardwell Street 1920s - Heritage sign,One of four signs installed as an initiative of the Elmore Progress Association. This sign features a photo of Cardwell St including the original Victoria Hotel.,-36.49515525,144.60801199
3372,3372,293,Cardwell Street,"Gazetted as the main street. Named after Rt. Hon. Edward Cardwell, Secretary of State for the Colonies, 1864. Traffic flow altered when a new bridge was built & Margaret St was constructed in the 60s.",-36.49509856,144.60832876
3373,3373,293,Former Bank of NSW/Westpac ,This double story building on the South side of the street is now privately owned and operates as Elmore Old Wares.,-36.49543082,144.60897504
3374,3374,293,Elmore Plaque Project,Wander down Cardwell Street and learn about some of the historic buildings by reading the plaques. The Elmore Plaque Project is an initiative funded by property owners. ,-36.49550762,144.60912945
3375,3375,293,Former Parson’s Store,"This store was established in 1893 and traded as a general store until 1982. Today, Parson’s Store is used as a display area, storage and workroom for the Elmore Miniature Railway.",-36.49572558,144.60957137
3376,3376,293,Michie Street ,"Named after Hon. Sir Archibald Michie, MLC, MLA, Attorney-General.",-36.49557158,144.60949474
3377,3377,293,Athenaeum Hall,"Built in 1885 for £800, & opened in 1886, the Athenaeum Hall was designed by W.C. Vahland & built by Mr G. Galbraith. ",-36.49488632,144.60998596
3378,3378,293,Elmore Scout Hall,"This former Methodist Church, built in 1874, was purchased as the Scout Hall in 1983.",-36.49444002,144.61029876
3379,3379,293,Michie Street Play Space,"The Michie Street Play Space features play equipment, drink fountain, seating, shade sails and a lush lawn space at the rear.",-36.49434922,144.6102298
3380,3380,293,Clarke Street,"Named after John Clarke, owner of Boramboot or Stewart’s Plains station from 1850-1852.",-36.49385808,144.61072676
3381,3381,293,Uniting Church ,"Originally St Andrew’s Presbyterian Church (WC Vahland design) opened June 18 1899, the Uniting Church was formed by an amalgamation of Methodist and Presbyterian Churches in 1969.",-36.49430336,144.61177666
3382,3382,293,Elmore and District Preschool,The Preschool was built as an Infant Welfare Centre (circa 1960s) and extended as a Preschool in 1972.,-36.49519954,144.61118097
3383,3383,293,Elmore Memorial Hall,In 1920 it was proposed to build a Memorial to the local service men of World War 1 & provide work for some returned service men. The information board provides greater detail.,-36.49537551,144.61105871
3384,3384,293,Elmore CFA Fire Station,"The Fire Station was opened on September 26 1972, replacing the one in Railway Place (1910-1972). The former site is now known as Progress Park near the Raywood Road Rail Crossing.",-36.49552367,144.61096191
3385,3385,293,Elmore Police Station,"The current Station was built recently to replace the former station, opened in 1968. Before this time, the Police Station was situated diagonally across the intersection, now a private residence.",-36.49593572,144.61089306
3386,3386,293,Law Courts ,The building next to the Police Station was built as the Law Courts but is now privately owned and used as a Solicitors and Accountants office.,-36.49618009,144.61077813
3387,3387,293,The Old Water Tower,Used to store the town’s water supply (pumped from the Campaspe). The pumping station was on rails to move up the bank in times of flood. The station also produced the town’s electricity until 1948.,-36.49665165,144.61173195
3388,3388,293,Coffee Palace/James’s Bakery,Originally a Coffee Palace & later James’s Bakery which was well known as the place for lovely bread fresh from the oven. This building (South side of Cardwell St) is now a private residence.,-36.49679079,144.6115796
3389,3389,293,Jeffrey Street,Named after the Jeffrey brothers who owned Burnewang Station from 1852 to 1867.,-36.49686266,144.61175842
3390,3390,293,Campaspe River,The Campaspe River rises in the Kyneton area & enters The River Murray at Echuca. Lake Eppalock (constructed by State Rivers & Water Supply Commission of Victoria 1961-64) is situated on the Campaspe.,-36.49683184,144.61197552
3391,3391,293,Campaspe River Natural Play Space ,"The Elmore Progress Association in conjunction with the City of Greater Bendigo are currently creating a natural play space on a former playground site. Drink fountain, seating and parking available.",-36.49677436,144.61205472
3392,3392,293,Campaspe River Walking Track ,The Campaspe River Walking Track meanders alongside the captivating Campaspe River. Dotted along the track are information boards which highlight the unique attributes of this stretch of the river.,-36.49673124,144.61212623
3393,3393,293,Campaspe River Pepper Tree Avenue,The Avenue of pepper trees between the Campaspe River Bridge and Childers Street along Campaspe Street was planted on August 10 1898. The trees were donated by the Elmore Water Trust. ,-36.4966799,144.61218755
3394,3394,293,Senior Citizens Flats (now Public Housing) ,The Catholic Church donated the triangle land (junction of Campaspe & Jeffrey Streets) to the former Shire of Huntly to build flats for Senior Citizens. ,-36.49658705,144.61209303
3395,3395,293,Our Lady of the Sacred Heart Catholic Church,The Church (WC Vahland design) was built in 1904. The Presbytery is next door.,-36.49492934,144.61325201
3396,3396,293,Elmore Senior Citizens,The Elmore Senior Citizens Clubrooms were built in 1973. ,-36.49367133,144.60999261
3397,3397,293,Brummy’s Seat,"An Elm tree (which has since been removed) had a circular seat placed around it and was known as Brummy’s Seat after Mr Bremner, blacksmith & Fire Brigade Captain, who loved to smoke his pipe there.",-36.49340518,144.60940725
3398,3398,293,Shopping Strip (Railway Place/Northern Highway),"Cardwell Street was the original main street, but with the construction of the new bridge & Margaret St, traffic flow changed & Railway Place/Northern Highway became the new main street. ",-36.49398039,144.60900505
3399,3399,293,Elmore Miniature Railway/Apex Park,"Built on the site of the Cohuna Goods yard, the Elmore Miniature Railway (EMR) line extends for 1.5kms, with the EMR station situated at Apex Park.",-36.49617455,144.60704294
3400,3400,293,Campaspe Run Play Space,"Situated in the centre of town between the Railway station & Campaspe Run, the Play Space has lush lawns, parking, public toilets, picnic tables and a BBQ. A great space to enjoy a picnic.",-36.49544921,144.60777175
3401,3401,294,Dandenong Civic Square,The Civic Square is a great new meeting place and the perfect place to start and finish the walk.,-37.98818325,145.21370406
3402,3402,294,Rob's British Butcher,"Visit Rob's British Butchers for home made UK Produce. Pork Pies, Black Pudding, Haggis, British style Bacon & Gammon, Gourmet Sausages and much more!",-37.98974328,145.21430133
3403,3403,294,Rye Crust Polish Bakery,"Rye Crust Bakery is  family owned and operated. The Bakery makes great cakes, biscuits, pies, sweets, soups, salads, bagels, cabbage rolls, pierogi and much more",-37.99014119,145.21321759
3404,3404,294,Little India,"Little India is the strip of Indian shops in and around Foster Street. It has a wide variety of Indian food, clothes, accessories and even an Indian museum. ",-37.98978395,145.21178804
3405,3405,294,Dandenong Train Station,"Dandenong Train Station is right in the middle of downtown Dandenong, with lots of services to and from Melbourne CBD.",-37.98944164,145.21055604
3406,3406,294,Afghan Bazaar,The Afghan Bazaar is the name of the strip of Afghani shops in and around Thomas Street. There is a growing number of Afghani restaurants and clothes stores here.,-37.98714213,145.21263654
3407,3407,294,Maiwand Tandory Hot Bread Bakery,"The Bakery specialises in tasty Tandoori breads, the breads are baked right in front of customers eyes in the three in-store ovens.",-37.98619478,145.2130189
3408,3408,294,Plenty of nice seats along the way,"The newly improved Palm Plaza provides plenty of seats and shade, great place to sit and digest!",-37.98552241,145.21433483
3409,3409,294,Dandenong Market,At Dandenong Market you will find almost every ingredient you can imagine—not to mention some you might never have dreamed of—making it the perfect place for anyone with a passion for cook.,-37.98423736,145.2156955
3410,3410,294,A1 Lebanese Bakery,The Bakery serves authentic Middle Eastern and Lebanese food as well as stocking a large range of grocery products direct from all over the Middle East and Lebanon.,-37.98909531,145.21423115
3411,3411,295,Cardinia Cultural Centre,"Complete with cafe, toilets, a theatre and some local artwork. Also available for function hire.",-38.06582314,145.4535073
3412,3412,295,Duck feeding frenzy!,"Throughout the loop, there are multiple piers - perfect for fishing or feeding ducks. The  pier at the eastern end of the lake, is the best spot to feed the local ducks and swans . ",-38.06618636,145.45301378
3413,3413,295,Amphitheatre  and grassed area,"A lot of local events are held in the  Amphitheatre. It is also  in front of a huge grassed area, perfect for playing sports.",-38.0663215,145.45230567
3414,3414,295,Watch your step...,"Although most of the lake has no safety railing, the footpaths are quite wide, and the lake is very  shallow. ",-38.06712394,145.44890463
3415,3415,295,Take a breather.,"Throughout the whole loop, there is plenty of seating with amazing lake views.",-38.06602587,145.44861495
3416,3416,295,"BBQ's, playground and toilets. ","At the western end of the loop is a great picnic area and playground, complete with multiple BBQ's, toilets and tonnes of play equipment - it's the perfect place to bring the family!",-38.06577246,145.44748843
3417,3417,295,A little artwork..,"Huh? Where did these guys come from?

""Segmented Landscape"" - Jennyfer Stratman
",-38.06635529,145.44722021
3418,3418,295,"Just keep walking, just keep walking..","The whole loop is averaged at 2,000 steps (1.5km) which is a fifth of the recommended amount of daily steps.",-38.06761385,145.45150101
3419,3419,295,Fountain,Have a sit down and watch the fountain for a while. Very relaxing!,-38.06710705,145.45358241
3420,3420,295,Did someone say Swans?,"Try and spot these guys around the loop! They can be out in the open, or hiding in the reeds..",-38.06681142,145.44756353
3421,3421,295,Fishing!,A great pier perfect for catching fish out on the lake.,-38.06763919,145.45191944
3422,3422,295,Wheelchair and Pram friendly!,The entire walk is surfaced in either concreted or boardwalk. Suitable for pretty much everyone!,-38.06771521,145.44991314
3423,3423,296,Start of Guide Track,Its a 200m walk along Guide Track to the start of the Button-grass walk.,-37.98586057,145.64202308
3424,3424,296,Friends of Bunyip State Park,Friends of Bunyip State Park developed the walk over three years with the aid of Parks Victoria Community Grant funding.  For more information about the group see http://bit.ly/VTBsXk.,-37.98672212,145.64358608
3425,3425,296,Hakea,"Look out for hakeas, particularly along the first part of the walk.  Hakeas need bushfires to propagate. The fire opens the woody fruits on the parent plant, releasing the seeds to germinate.",-37.98772101,145.64293394
3426,3426,296,Heathy Woodland,"Walkers wandering through a forest of Silver-leaf Stringybark and Narrow-leaf Peppermint trees.  Look out for wattles, hakeas and tea-trees in the shrub.",-37.9881301,145.64119488
3427,3427,296,Skink,Pay attention to where you step.  You might spot a skink out enjoying the sun.  They are well camouflaged to avoid detection.,-37.98969517,145.63766681
3428,3428,296,Numbered Markers,"For lots of detail about the abundant flora along the walk, pick up a copy of the flora notes at the beginning of the walk.  The notes have matching numbered markers along the route.",-37.99242888,145.6345173
3429,3429,296,Wet Heathland,Notice the dramatic changes in flora as we drop down into the wet heathland areas along the walk. You will also be treated to excellent views of the nearby Black Snake Range.,-37.9932132,145.63929507
3430,3430,296,Boardwalk,A boardwalk allows the waker to keep their feet dry while giving the opportunity to explore parts of the wet heathland that would otherwise be hard to access.,-37.99299463,145.64062847
3431,3431,296,Button-grass and Spike Wattle,"Sedges, such as Button-grass, are tufted plants and over time develop quite dense and tall stools from which the leaves grow. These tufts are elevated above the water-table.",-37.99052758,145.64351982
3432,3432,296,The dam,"The dam is feed by Button-grass creek.  Notice the many water plants and ferns that boarder the waters edge, a habitat for birds, frogs and insects.",-37.98773654,145.6446613
3433,3433,297,Make some friends,Say hello to these beautiful creatures on your way,-36.11343805,146.88396757
3434,3434,297,Autumn beauty,These beautiful trees create splendid colour in Autumn and lush cover in summer ensuring that you are shaded from the harsh summer sun. Not to mention they are pretty easy on the eyes!,-36.12338178,146.8750861
3435,3435,297,Tyre swing,"This hidden gem has a picnic table and a tyre swing making it the perfect spot to stop, rest and play. ",-36.11417307,146.88159618
3436,3436,297,Old railway,Take a stroll under the old railway line and take in some of our history. Make sure you turn to the right to keep on the track!,-36.11575395,146.87897721
3437,3437,297,Over path bridge,"This is another of Wodonga's many excellent under road paths. Not only is it practical in removing the need to cross in front on traffic, but it is an engineering beauty ",-36.11897646,146.87789125
3438,3438,297,Skate Park,There is a skate park here that is incredibly popular and it looks like bigger and better things are on their way!,-36.13678318,146.87734979
3439,3439,297,Oval & Playground,Willow park is home to an oval and play area and is great recreational hub. Perfect for a picnic of a short rest before you begin the return part of the circuit,-36.13514957,146.87470458
3440,3440,297,Netball courts,"For anyone wanting to spend some time at a netball court, these are tucked away at Martin Park and there is a gate from the walking track to the park",-36.13425552,146.87862136
3441,3441,297,Nature at its finest,"The path is edged by beautiful trees almost the whole way along. Providing much needed shade in the warmer months and an excellent display of colour in Autumn, they are also home to many types of Bird",-36.12906302,146.8732611
3442,3442,297,Football Oval,"If you are walking along this path, why not stop for a kick of football on the way. The oval is well manicured and is home to permanent AFL posts. A little friendly competition never hurt anyone...",-36.12746456,146.87468193
3443,3443,297,Under road crossing,Avoid crossing this busy road by taking the optional path underneath the thoroughfare. Great low risk option for people walking with groups of children or animals.,-36.12685225,146.87535094
3444,3444,297,Les Stone Park Wetlands,A great spot to try your hand at fishing. Even better if you have young children as it offers a safe space to teach them the skills.,-36.12560684,146.87564671
3445,3445,297,Pirate Ship,This play area is great. A safe space that lets the imagination run wild. Grab your eye patch and perch a bird on your shoulder and see what adventure you end up on,-36.12302567,146.87475275
3446,3446,298,Map and information,"Start off by having a look at the information board to orientate yourself. There are public toilets, barbeque and picnic tables here.",-37.73157727,145.24117387
3447,3447,298,Yarra River,Yarra River is a great spot for a dip on a warm day. You'll be sharing the river with the ducks and other bird life! You can launch your canoes from here.,-37.73134816,145.24065996
3448,3448,298,Begin Blue Tongue Bend Walk,Marker for the start of the Blue Tongue Bend Walk. Only a couple of kilometres of blissful bushland to wander through. ,-37.73100262,145.2412677
3449,3449,298,Bushy goodness,Take a sniff or two of the fresh air around you.,-37.72839155,145.24248701
3450,3450,298,River view,You'll be able to glimpse the river from the track at various sections.,-37.72719142,145.24125674
3451,3451,298,Wild mushrooms tour,"Q: Did you hear the joke about the fungus? A: I could tell it to you, but it might need time to grow on you.",-37.72672651,145.23797028
3452,3452,298,More mushies,Q: Why did the Fungi leave the party? A: There wasn't mushroom.,-37.72662662,145.23705317
3453,3453,298,A darker variety,"Q: Why did the Mushroom get invited to all the parties? A: 'Cos he's a fungi!

",-37.72475792,145.23655764
3454,3454,298,Stuck on you,"Ok, I've run out of fungi jokes. This one's the biggest that I came across during the walk. ",-37.72209276,145.23534763
3455,3455,298,Dappled sunlight through the forest,"A perfect location to practice your camera taking skills, or simply enjoy the light and shadows.",-37.72122546,145.23541891
