,index,walk_id,title,summary,lat,lng
1040,1040,77,Vegetation,In 1931 a mixture of exotic and native trees were planted in the Reserve and are now thriving.,-37.48819093,148.15595292
1041,1041,77,Falls viewing platform,A scenic place to rest and admire the falls (when there is water). Be sure to look out for water dragons! ,-37.48487254,148.15381325
1042,1042,77,Kanooka Track,This track has some uneven and rocky sections and steps.,-37.48540859,148.15457595
1043,1043,77,Lyrebird,A rare sighting of a shy native Lyrebird. This female does not have the same unique tailfeathers as the male.,-37.49120437,148.15878868
1044,1044,77,Swamp Wallaby,The Reserve is a wildlife refuge so animal life is abundant. This wallaby was on the path!,-37.49237884,148.1592444
1045,1045,78,Rowville Community Centre,"The centre runs a variety of programs and is dedicated to the provision of high quality, financially accessible services and educational programs in a welcoming and respectful environment.",-37.91933154,145.23936816
1046,1046,78,Rowville Uniting Church,"Rowville Uniting Church is located on Bridgewater Way & Fulham Rd, Rowville",-37.91888371,145.24148149
1047,1047,78,Rowville Lake,"Welcome to Rowville Lakes. There are over 300 minor parks, reserves and playing fields spread throughout the City of Knox that cater for all forms of leisure and recreational activities.",-37.9153433,145.24240345
1048,1048,78,Rowville Lake walking track,Follow the path running between Suttons Lake and Hill Lake,-37.91507271,145.24241386
1049,1049,78,Suttons Lake,Enjoy the view of Suttons Lake,-37.91490392,145.24207214
1050,1050,78,Playground,Enjoy some time out with family at the playground overlooking Suttons Lake. Knox has over 200 play spaces in parks and reserves.,-37.91410156,145.24096064
1051,1051,78,Suttons Lake,Enjoy the view and follow the path around to Superior Ave.,-37.9131665,145.23954582
1052,1052,78,Map of Rowville from 1981,The Knox Historical Society has included a photograph of the Rowville area from back in 1981. As you can see the Rowville lakes are featured.,-37.91314998,145.23716672
1053,1053,79,Tarra Bulga Visitor Information Centre,A great starting point for exploring this National Park,-38.42953737,146.56664823
1054,1054,79,Bulga Picnic Area,"Tables, toilets and picnic shelter provided.",-38.42552244,146.57125748
1055,1055,79,Corrigan Suspension Bridge,"Corrigan Suspension Bridge stretches through the rainforest canopy, affording spectacular views of the lush fern gully on the forest floor below.",-38.42473088,146.57345295
1056,1056,79,Lyrebirds,The fern gullies are the home of the Superb Lyrebird.,-38.42469705,146.56931092
1057,1057,80,Ringwood Railway Station,Start at Ringwood Railway Station fronting Maroondah Highway. The station was built in 1889 after the railway line was extended from Hawthorn to Ringwood. The line was electrified in 1923.,-37.81618599,145.22943311
1058,1058,80,The Clock Tower's original site,Proceed easterly to the intersection of Warrandyte Road and Maroondah Highway to the original site of the Ringwood Memorial Clocktower. Erected in 1928.,-37.81488623,145.2311812
1059,1059,80,Blood Bros Stores,"Deviate under the railway viaduct to view the Blood Brothers store, built in 1914 and continuously operating for over 95 years.",-37.81560696,145.23134
1060,1060,80,Maroondah Federation Estate and Maroondah Art Gallery,"Walk along Greenwood Avenue to number 32, the site of the former Ringwood Primary School. It is now a Council owned & managed community, cultural and arts facility. Return the same way back to Highway",-37.81880455,145.23083046
1061,1061,80,Ringwood Lake,"Continue easterly along Maroondah Highway, pause at Ringwood Lake, created in 1926 by the damming of Sandy Creek which used to follow the line of the gully and flow into Mullum Mullum Creek.",-37.81191347,145.23681314
1062,1062,80,Ringwood Fire Station,Cross the highway and head west. The former Ringwood Fire Station was built in 1930 at a cost of seven thousand pounds and provided an important service for over 65 years. It is currently a restaurant,-37.81324418,145.23341917
1063,1063,80,Bamford's Timber Yards,Bamford's Timber Yards were a landmark at the northwestern corner of Warrandyte Road and were close to the majestic Block Buildings (1912) on the northeastern corner of Adelaide Street.,-37.81444534,145.23061481
1064,1064,80,Block Buildings & Coffee Palace,"Block Buildings and the Ringwood Coffee Palace were amongst the earliest commercial premises in Ringwood, on the northwestern corner of Adelaide Street (now covered by Eastland Shopping Centre).",-37.81471516,145.22962101
1065,1065,80,The Mail Office,"Head north into the Eastland precinct, which in earlier years was home to The Pines Private Hospital, Ringwood Football Ground, and the offices of the Ringwood Mail.",-37.81426087,145.22948113
1066,1066,80,Ringwood Town Hall,"Return to the highway, at the northwestern corner of Melbourne Street, to the site of the Town Hall of the Borough of Ringwood, built in 1927 and demolished in 1970.",-37.81524615,145.22839596
1067,1067,80,The State Savings Bank,"A sign of prosperity in Ringwood was
the construction of the State Savings Bank in 1923 at a cost of three thousand pounds. The building still exists behind an unsympathetic facade.",-37.81538527,145.22797772
1068,1068,80,Ringwood Timber & Trading Company Limited,"On the north eastern corner of New Street, the Ringwood Timber & Trading Company constructed a fine building to cope with demand for building materials at a time of rapid development. Demolished 1981.",-37.81680195,145.22081223
1069,1069,80,Ringwood Co-operative Cool Stores,"Crossing back to the south side of Maroondah Highway, wander back to the
Clock Tower, located on the site of Ringwood Coolstores (1911-65), evidence of the importance of Ringwood's orchard enterprises",-37.81622486,145.22739227
1070,1070,81,Oscars Walk,Oscars Walk beside the Bendigo Bank starts the southern section of the Bendigo Creek Trail.,-36.76001141,144.27802256
1071,1071,81,Oscars Walk,Bendigo Creek Trail beside Oscars Walk,-36.76063079,144.27759222
1072,1072,81,Central Deborah Gold Mine,Central Deborah Gold Mine,-36.76513053,144.27121471
1073,1073,81,Vintage Talking Tram,Vintage Talking Tram,-36.76564873,144.27036957
1074,1074,81,Golden Square Fire Station 1909,The Golden Square Fire Station 1909 shows the way.,-36.76947223,144.26407346
1075,1075,81,Bridge to north side of Bendigo Creek,Bridge to north side of Bendigo Creek,-36.76975598,144.26474729
1076,1076,81,Central City Caravan Park,Central City Caravan Park,-36.771638,144.25482752
1077,1077,81,Bendigo Creek with paths,Bendigo Creek with paths,-36.77352553,144.25222951
1078,1078,81,Cooinda Park,Cooinda Park with children's playground,-36.7841379,144.24566923
1079,1079,81,Rotary Gateway Park,Rotary Gateway Park with lake and plentiful birdlife,-36.78768946,144.24436267
1080,1080,81,Rotary Gateway Park,Rotary Gateway Park with seating,-36.78822085,144.24421061
1081,1081,81,Rotary Gateway Park,Rotary Gateway Park with BMX track,-36.78833259,144.24417864
1082,1082,81,Oval with resident ducks,Oval with resident ducks,-36.79072212,144.24330832
1083,1083,81,Yellow flowering gumtree,Yellow flowering gumtree,-36.7937597,144.24232033
1084,1084,81,Red flowering gumtree,Red flowering gumtree,-36.79855329,144.24068407
1085,1085,81,Daffodils make an early appearance,Daffodils make an early appearance,-36.80126134,144.23997402
1086,1086,81,Crusoe Reservoir Gate 6 entrance,Crusoe Reservoir Gate 6 entrance,-36.8177456,144.22955933
1087,1087,81,Gravel path to Crusoe Reservoir,Gravel path to Crusoe Reservoir,-36.82118533,144.22997214
1088,1088,81,Crusoe Reservoir,Crusoe Reservoir,-36.821664,144.22998133
1089,1089,81,Crusoe Reservoir spillover,Crusoe Reservoir spillover,-36.82184454,144.22969022
1090,1090,82,Signage to show your walking choices,"At the Ollerton Ave entrance, you are given an overview of the walking track options available to you so you can choose each time you visit a different approach.",-38.17875114,146.27944368
1091,1091,82,A place to play,There’s plenty of room for the kids to run around in the Bushland Reserve as well as a couple of playground at the perimeters of the Reserve.,-38.17772039,146.27934068
1092,1092,82,Walking the dog,"This is a popular place for taking your pooch on an enjoyable walk through native bushland, although remember to keep your furry friend on the leash.",-38.17706571,146.27957833
1093,1093,82,Native bushland in the middle of Moe,A visit to this Reserve showcases the indigenous landscape that used to cover this area.,-38.17651277,146.28069413
1094,1094,82,Follow the track,"Whether you follow the concrete track or cut into the Reserve on one of the many natural paths, you’ll discover a healthy mix of native bushland.",-38.1762024,146.28230131
1095,1095,82,The Fringing Lily,Just one of the many native orchids you’re likely to see if you keep an eye out.,-38.17693785,146.28401792
1096,1096,82,Cinnamon Bells,"This is a wonderful Reserve for fans of orchids and keen photographers, with magnificent specimens such as these. ",-38.17716051,146.28180349
1097,1097,82,The Bearded Orchid,Yet another example of why this bushland reserve is so famous for its orchids.,-38.1773022,146.28069627
1098,1098,83,Listen for lyrebirds,"The trail begins in the shade, walking through towering manna gums. Listen for lyrebirds and their complex bird calls ringing continuously through the forest.",-37.51498524,145.74718237
1099,1099,83,Fantastic fungi,Watch your step because there are several types of fungi growing along this trail. Learn more about mushrooms in Australia by the link below.,-37.51517246,145.74690342
1100,1100,83,Leary Creek,"This trail crosses Leary Creek in two spots. Badly affected by the Black Saturday bushfires, the creek contains one of the few remaining populations of a nationally endangered fish, Barred Galaxias.",-37.51532564,145.74649572
1101,1101,83,Rest spot,There are a couple of benches along the trail and several interpretative signs if you'd like to know more about the flora and fauna native to this area. Look for signs of wombats digging as you rest.,-37.51556392,145.74598074
1102,1102,83,Felled gums,"Even when felled, the beauty of these gums remain. Some of the fellings will be accidental and caused by the weather, others will be deliberate clearing efforts.",-37.51626174,145.74553013
1103,1103,83,Tiny moments,"If you look carefully, you'll see tiny moments of interaction between the natural world, like a drop of sap that's fallen over 100 metres to land on this fern.",-37.51682339,145.74537992
1104,1104,83,Bushland renewal,"After the Black Saturday bushfires, signs of renewal and regrowth came from the resilient tree ferns, their bright green fronds striking against a backdrop of burnt out Manna gums.",-37.51690849,145.74537992
1105,1105,83,Fungi fiefdom,"As trail starts to descend into the tree fern groves, the fungi find themselves in a darkened paradise. At your feet, you might also notice birds foraging about, looking to feast on small insects.",-37.51782754,145.74533701
1106,1106,83,Boardwalks,"This trail includes a fantastic boardwalk pathway through fern tree groves. In 1939, a bushfire rushed through The Beauty Spot and destroyed these very same groves, along with a popular tourist spot.",-37.51852534,145.74456453
1107,1107,83,Hideaway,"This is a cooler spot to rest, hidden in the lush ferns and overhanging foilage. The trail is in a similar state of transition today, after being reconstructed following the Black Saturday bushfires.",-37.51818495,145.7436204
1108,1108,83,Pobblebonk frog,"As you walk through the wetlands, listen for the call of the Pobblebonk or banjo frog, named because of the 'bonk' sound it makes, like a banjo string being plucked.",-37.51682339,145.74501514
1109,1109,83,Follow the light,"The boardwalk resumes again, this time leading walkers in the direction of the light. Look up to spot bright-coloured parrots or wattle birds, raucously guarding their precious nectar supplies.",-37.5155469,145.74557304
1110,1110,83,Valley beyond,As you walk towards the carpark look out towards the other side of Marysville and the valley for a reminder of how much was lost in the bushfires and all that is now slowly regenerating each day.,-37.5152533,145.74636698
1111,1111,84,Vervet Monkeys,Observing the complex interactions between these highly social animals is one of the highlights of a visit to Werribee Open Range Zoo.,-37.92245146,144.66478457
1112,1112,84,Lions,The zoo provides a rare opportunity to see these majestic animals up close.,-37.92175557,144.66352547
1113,1113,84,Hippos,The zoo provides a rare opportunity to get up close to these intriguing animals. You can sit and watch the hippos along the Pula Walking trail as well as seeing them while out on Safari,-37.92012611,144.66490481
1114,1114,84,Serval,These slender and extremely agile cats are one of Africa's most successful hunters,-37.92064524,144.66618036
1115,1115,84,Safari Station Tours,"Imagine being surrounded by magnificent wildlife, including rhinos, giraffes, zebras and antelopes, or taking the perfect safari photo just 30 minutes from Melbourne's city centre.",-37.92168131,144.66742736
1116,1116,84,Przewalski's horse,"Przewalski's horse. The baby was born in 2014. It's name is Hatan. The breed is the last truly wild horse, is skittish, stubborn, naturally shy and sometimes very aggressive. ",-37.92110916,144.66429628
1117,1117,84,Ibis,"Ibis are a group of long-legged wading birds that inhabit wetlands, forests and plains. They all have long, down-curved bills, and usually feed as a group, probing mud for food.",-37.92022091,144.66481469
1118,1118,84,Rhino,"Rhinoceros are a threatened species that have only one predator, humans, who prize them for their hooves, blood, urine and above all for their horns for use in traditional medicines.",-37.92055106,144.66456777
1119,1119,84,Ostrich,The ostrich is the fastest flightless bird and can reach sprinting speeds of up to 70 kilometres per hour. The ostrich also uses its wings for displays of courtship and dominance.,-37.9214466,144.66402731
1120,1120,84,Impala,Impala are medium sized African antelopes that inhabit savanna grasslands and woodlands in close proximity to water sources.,-37.92065145,144.66453052
1121,1121,85,Lions Park,"A small park beside the Campaspe River with a playground, barbeque, picnic table and toilet facilities",-36.13935625,144.73990482
1122,1122,85,Exercise Equipment,Along the the walking path are a number of exercise equipments,-36.13679166,144.73851072
1123,1123,85,Walking Path,The walking path follows the Campaspe River ,-36.13750318,144.73874199
1124,1124,85,Footbridge,A footbridge crosses the Campapse River,-36.13687698,144.73853845
1125,1125,85,Exercise Equipment,A number of exercise equipments are located along the walking path,-36.13077808,144.73775983
1126,1126,85,Walking Path,The walking path meanders along the river,-36.12949559,144.73775983
1127,1127,85,Campaspe River,Campaspe River,-36.1291602,144.73823619
1128,1128,85,Walking Path,The walking path follows the former road reserve of Campaspe Esplanade,-36.12831847,144.74208007
1129,1129,85,Walking Bridge,Walking Bridge provides link to Echuca CBD,-36.12751679,144.74231059
1130,1130,85,Walking Path,Walking path meanders along the Campaspe River,-36.12689877,144.74245634
1131,1131,85,Walking Path,The walking path travels through natural bushand,-36.12124753,144.74371452
1132,1132,85,Pascoe Park,A picnic spot beside the Campaspe River,-36.12066193,144.74408036
1133,1133,85,Campaspe River,Campaspe River,-36.12143997,144.74376929
1134,1134,85,Hopwood Gardens ,Hopwood Gardens in the Port of Echuca with a playground and nearby picnic and toilet facilities,-36.11970864,144.74587548
1135,1135,85,Bridge Hotel,The historic Bridge Hotel overlooks the Hopwood Gardens,-36.11972979,144.74583567
1136,1136,86,Botanic Gardens Entrance,"The entrance, with one of the most unusual trees around, marks the beginning of the walk.",-38.14913965,144.37590837
1137,1137,86,Open Park,"Lots of open park land along the way, dotted with trees.  A great natural playground.",-38.1507549,144.38125642
1138,1138,86,Flying Foxes,"Flying foxes travel up to 50km a night to feed on pollen, nectar and fruit.  They fulfil a very important ecological role by dispersing the pollen and seeds of a wide range of Australian plants.",-38.14951652,144.38258056
1139,1139,86,Trees,The park trees come in all shapes and sizes.  It provides a great opportunity to test your tree naming skills.,-38.14701515,144.38391543
1140,1140,86,The path along the bay,"As you turn the corner here, the beautiful bay opens up on your right.",-38.1456916,144.38254697
1141,1141,86,Corio Bay,Looking out across the bay you can marvel at how much has changed as the city developed.,-38.14692583,144.37970498
1142,1142,86,Geelong Play Space,"A play space for all, allowing physical and explorative play and a sense of wonder within a culturally sensitive environment.  There are 20 significant landscape areas or features to find and explore.",-38.14792298,144.37802676
1143,1143,86,Botanic Gardens,"The gardens were renovated in 2002, with a new section for arid-climate and local native plants opened. It features a dramatic entrance combining architectural plants with modern garden sculptures.",-38.14896381,144.37644797
1144,1144,86,Friends of the Garden,"Free guided walk in the gardens are offered by the Friends of Geelong Botanic Gardens on Wednesdays and most Sundays at 2pm, weather permitting.   For more information visit http://friendsgbg.org.au/.",-38.14938477,144.3770575
1145,1145,86,The Gardens,In 1851 the Government had the foresight to set land aside at the edge of the Geelong settlement for the development of a Botanic Garden.  The grounds can now be enjoyed throughout the year.,-38.15033257,144.37838623
1146,1146,86,Flora of the gardens,"The gardens are full of fascinating plants with unusual shapes, textures and colours. 
",-38.15012422,144.37795088
1147,1147,86,The Tea Room,"There is a lovely tea house in the Botanic Gardens which is open from 11am to 4pm.
",-38.15002319,144.37727643
1148,1148,87,Tim Neville Arboretum playground,"The upgraded Children’s Garden includes new walking paths, adventure garden rooms including a butterfly garden and all abilities playground. ",-37.87517735,145.28607009
1149,1149,87,Knox Memorial and Honour Roll,The names of 120 members of the Australian military services from Knox who lost their lives while serving their country are honoured at the Knox Memorial and Honour Roll in the Tim Neville Arboretum.,-37.87527878,145.28578583
1150,1150,87,Tim Neville Arboretum,Walk along the duck pond toward the children’s playground,-37.87569866,145.28576281
1151,1151,87,Car park,Parking is available off Francis Cres outside the Tim Neville Arboretum. Bike racks available. ,-37.87657129,145.28563592
1152,1152,87,Blind Creek Trail shared path,Enter off Dorset Road and follow the trail along toward Scoresby Road.,-37.87364975,145.28432409
1153,1153,87,Blind Creek Trail playground,Enjoy time with family at one of over 200 playgrounds in Knox,-37.87315823,145.28216869
1154,1154,87,Blind Creek Trail shared path,Continue on the Blind Creek Trail.,-37.86818292,145.27196798
1155,1155,87,U3A  (Formerly University Of The Third Age),Specifically for those over 45 years of age and retired from full-time employment. The provision of low cost educational and recreational activities in a non-competitive environment.,-37.86863146,145.26256134
1156,1156,87,Friends of Knox – Blind Creek Billabong Group,"This group assists with the implementation of the Blind Creek Billabong Management Plan. The Blind Creek Billabong Group meet regularly & conduct weeding, rubbish removal and indigenous planting. ",-37.86853571,145.27502768
1157,1157,88,Table & Chairs,this is on the other side of the Tourist Information Centre,-37.71062404,142.84222126
1158,1158,88,Garden ,Garden,-37.71094235,142.84246503
1159,1159,88,Tourist Information Centre,Collect your historical guide for the town and information regarding the region.,-37.71124137,142.84192491
1160,1160,88,Start of Walk,You can go either way around the Tourist Information Centre for the Heritage Walk,-37.71138843,142.84160275
1161,1161,88,BBQ Area,Why not stop and cook a BBQ or have a picnic,-37.71134065,142.84138605
1162,1162,88,Playground,Let the kids have play for a while,-37.71120119,142.84127756
1163,1163,88,Tractor,Things to See on the Walk,-37.71099969,142.84112082
1164,1164,88,Artwork,along the track,-37.71075366,142.84125726
1165,1165,88,Rest Spots,Not take a seat and enjoy a relax in shade of the trees,-37.71057652,142.84147308
1166,1166,88,Art work,Path details - see what different ones you can spot,-37.71052012,142.84169253
1167,1167,88,Out the front,Garden ,-37.7110578,142.84229723
1168,1168,88,Toilets,Toilet block,-37.71153412,142.84125217
1169,1169,88,Hisotrical Site,General Store ,-37.71212877,142.83943043
1170,1170,88,Historical Site,Lake Bolac Hotel - Lovely bluestone building,-37.71269793,142.83928594
1171,1171,88,Historical Sites,"Long this road there are number historical sites: Original hall site, Park's Blacksmiths Shop, Memorial Tree, and Tom Leach's Saddlery Shop",-37.71306209,142.83923539
1172,1172,88,Historical Site,National Bank Site,-37.71267268,142.84027129
1173,1173,89,Getting familiar with the Rail Trail,A map at both the start and end of this trail is a great way to get an overview of the journey you’re taking.,-38.17700878,146.26665759
1174,1174,89,Botanic Gardens,"This beautiful reserve off Narracan Drive provides shade, the rotunda, picnic facilities along with a skate park, and is a well-loved site for locals and visitors alike.",-38.17653833,146.2707839
1175,1175,89,Signage as art and art as signage,"Created by school children who live in the area, the unique signs are dotted along the trail and indicate side trips you can make. ",-38.17448815,146.27829409
1176,1176,89,Emergency markers provide safety,"Designed to pinpoint your exact location in the case of an emergency, you can be sure that in this unlikely event, you’ll find markers installed along the entire trail. ",-38.17387346,146.28120375
1177,1177,89,Say hi to the horses,"It’s not uncommon to come across others, some on horseback whilst others are walking or bike-riding, and to stop for a chat.",-38.17361216,146.28292465
1178,1178,89,View from the Old Sale Bridge,This is a lovely spot to stop at and look across the Latrobe Valley to the Great Dividing Range as well as down upon the rail trail and wave to others making the trip.,-38.17294112,146.28555107
1179,1179,89,Take a trip along the boardwalk,"There’s nothing quite like quietly walking along a boardwalk over a busy waterway, and depending on the time of day, you can be treated to a full orchestra of bird and frog song.",-38.16335118,146.31808948
1180,1180,89,Lake Narraccan Jetty,"The detour at Sullivans Road to Lake Narraccan is well worthwhile, especially for a picnic or BBQ lunch, a throw of the fishing line, some sightseeing and even a swim. ",-38.16178856,146.31285381
1181,1181,89,Glimpses of Hall's Bay,"Looking north through the trees near the eastern end of the trail, this beautiful stretch of water is a popular venue for water sports and the site of more than one national water-skiing championship.",-38.17107067,146.33127308
1182,1182,89,The Yallourn Cooling Towers,"A breathtaking view of the working example of a coal station, where these huge towers both cool and recycle the water in the process of generating electricity.",-38.17684651,146.33613968
1183,1183,90,Entrance to Geelong Botanic Gardens,Entrance to Geelong Botanic Gardens,-38.14900984,144.37605429
1184,1184,90,21st Century Garden,21st Century Garden,-38.14897961,144.37619023
1185,1185,90,Entrance to Heritage Garden,Entrance to Heritage Garden and bollards of original curator,-38.14931528,144.37699052
1186,1186,90,Traill Fountain and urn,Traill Fountain and urn,-38.1496868,144.37766833
1187,1187,90,Storks sculpture,Storks sculpture brought from Japan in 1880s,-38.15026556,144.37886613
1188,1188,90,Geelong’s tiny first Customs House from 1838 ,Geelong’s tiny first Customs House from 1838 ,-38.15058975,144.37888136
1189,1189,90,Begonia house,Begonia house,-38.1504326,144.37902507
1190,1190,90,View of gardens,View of gardens,-38.15055923,144.37800503
1191,1191,90,Chinese lantern,Chinese lantern,-38.15048059,144.37783813
1192,1192,90,John Raddenberry Fern Garden,John Raddenberry Fern Garden,-38.15026013,144.37760122
1193,1193,90,Open lawn space,Open lawn space,-38.14997233,144.37825082
1194,1194,90,Friendly blackbird,Friendly blackbird,-38.15010416,144.37781421
1195,1195,90,Pretty floral display,Pretty floral display,-38.14971858,144.37856304
1196,1196,90,Bunya bunya pine,Bunya bunya pine,-38.14990729,144.37889497
1197,1197,90,Pool in 21st Century Garden,Pool in 21st Century Garden,-38.14929931,144.37611913
1198,1198,90,Cacti in 21st Century garden,Cacti in 21st Century garden,-38.14933068,144.37622388
1199,1199,91,The Welcome Mural,Gunaikurnai artist Ron Edwards provides an excellent overview of the cultural trail and murals.,-38.23540075,146.42410326
1200,1200,91,Introduction to the cultural trail,This mural is well worth reading as it provides the context for the cultural trail.,-38.23507099,146.42406893
1201,1201,91,The bush tucker garden,"Over 27 species of native plants are included in this garden, all with important roles to play in the wellbeing of the Gunaikurnai people.",-38.23457037,146.42419016
1202,1202,91,The Creation story,"This mural tells the Dreamtime story of Borun the pelican man and Tuk, his musk duck wife.",-38.2339973,146.42436397
