,index,walk_id,title,summary,lat,lng
2125,2125,179,Lock Island,"Cross over the lock and explore Lock Island. During Mildura’s temperance era (1887-early 1900’s), this island was known as Pinkie Bend, due to the amount of illegal liquor drunk on the island.",-34.17373252,142.15942075
2126,2126,179,Various Sculptures,Along Cueton and in the Art Centre lawns you will see significant sculptures from the Mildura Sculpture Triennials which took place between 1961 and 1988.,-34.17656609,142.15929435
2127,2127,179,Mildura Arts Centre and Cafe,"In 1966, an art gallery and theatre were added to Rio Vista house and the whole complex became known as the Mildura Arts Centre and was officially opened by Sir Henry Bolte in November 1966. ",-34.17670665,142.15945457
2128,2128,179,The Grand Hotel,"Enter the Grand Hotel’s main entrance and turn left.  To your right, you will see a display of historical photos. Through the glass doors are one of Mildura’s original Chaffey fountains.",-34.18286468,142.16361139
2129,2129,179,Prince and Princess of Wales Fountain Plaza ,This fountain is very special as it was opened by the Prince and Princess of Wales on the 29th October 1985. Many Mildura residence crowded around to see the Princess Diana.  ,-34.18354009,142.16441479
2130,2130,179,Railway overpass,"A short walk across the railway overpass leads back to the riverfront, to
your car and to the end of this walk or head down to the Hugh King Drive underpass to avoid the stairs.
",-34.18358926,142.16447327
2131,2131,179,The Bungalow,"A Queen Anne style home, it is in keeping with its revered neighbor. The original owner of the Bungalow was Lancelot Conway-Gordon and later was home to J.H Shilliday. It remains a private residence.",-34.1776183,142.15973239
2132,2132,179,The Mildura Wharf,Mildura Wharf has been a vital part of the town and inland river transport system since the 1880s. It was established by the Mildura Progress Committee in 1888 to assist the burgeoning river trade.,-34.18337013,142.1667014
2133,2133,179,MIldura Rowing Club,"Rowing is a popular sport in Mildura and the club hosts an annual Easter Regatta that sees crews visit from across three states.

Attached is a photo of the Rowing Club in the 1931 floods.",-34.18248201,142.16523311
2134,2134,179,The Powerhouse,"The Powerhouse, which operated from the 1920’s through to the 1950’s, until the S.E.C took over Mildura’s electricity supply. It is now used by several community groups inc the Mildura Theatre Company",-34.18103522,142.16469686
2135,2135,179,Jaycee Park,"Jaycee Park is adjacent to the Powerhouse and is a perfect spot for family fun with and fabulous play equipment, BBQ areas and shady spots. A large locomotive dominates the grassed area to the front.",-34.18012945,142.16436611
2136,2136,179,MIldura Lawn Tennis Club,"One of Australia's leading tennis venues, featuring 32 world class grass courts. In 1997 some Davis Cup matches were played on these courts, and it attracts a number of tournaments each year.",-34.17682431,142.1632529
2137,2137,179,Mildura Weir,"Construction of the Mildura Weir began in Aug 1923 with the aims of raising both the water level & the pressure from the Mildura & Red Cliffs irrigation pumps. Picture,:View of Weir from Lock 11.",-34.17640725,142.16301975
2138,2138,179,Lock 11,Completed in 1928. Paddle steamers still pass through the lock daily. The Mildura system is the only site on the River Murray where a lock and weir are separated by an island. Image: Construction 1927,-34.17412588,142.15975501
2139,2139,179,Rio Vista House,"Rio Vista, which is Spanish for River View, was completed in 1892 . Rio Vista was the home W.B Chaffey, built in a tangible show of his faith in the future of the district he founded.",-34.17674246,142.15949982
2140,2140,179,Old Railway Carriage Sheds,"The old sheds, 36 metres long, extending from Olive to Pine Avenue, had 24 bays for carriages which were an essential form of protection from Mildura’s extreme heat. 
",-34.180181,142.1604073
2141,2141,179,MIldura Railway Station,Mildura’s railway commenced operation in 1903 and the current station was completed in 1978.,-34.18154901,142.16203682
2142,2142,180,The Legacy StreetArt Mural Project ,The Legacy StreetArt Mural Project is an art installation created by members of the Legacy family to celebrate the Centenary of ANZAC.,-37.81121159,144.96412981
2143,2143,180,Graffiti dragon,Graffiti dragon in Drewery Lane,-37.81122789,144.9641379
2144,2144,180,Baroq House,"In Drewery Lane is Baroq House, which has an enormous white sculpture of two entwined figures attached to the building. ",-37.81115076,144.96409964
2145,2145,180,St Francis Church,"St Francis Church, Melbourne’s first Catholic cathedral.",-37.81127071,144.96197249
2146,2146,180,Phillips Shirts ,"Phillips Shirts,  a family business that has been making shirts for over 60 years.",-37.81144867,144.96128894
2147,2147,180,Thousand Pound Bend,"Thousand Pound Bend café, formerly a garage.  It looks a bit grungy on the outside but good food and coffee can be found within",-37.81147418,144.96119961
2148,2148,180,Victorian Titles Office,"Victorian Titles Office, 283 Queen St. Now a campus of Victoria University",-37.81204931,144.95924146
2149,2149,180,Former Records Office,"Former Records Office, 295 Queen St.  Now a campus for Victoria University now.",-37.8120573,144.95921344
2150,2150,180,364 Lt Lonsdale St,The former buildings for the Women’s Venereal Disease and adjacent TB Clinic sit at 364-378 Lt Lonsdale St. ,-37.81215009,144.95889234
2151,2151,180,364-378 Lt Lonsdale St,The former buildings for the Women’s Venereal Disease and adjacent TB Clinic sit at 364-378 Lt Lonsdale St. ,-37.81216552,144.95883823
2152,2152,180,Children's Court of Victoria,The Children’s Court of Victoria is another notable building at 477 Lt Lonsdale St ,-37.81241635,144.95796054
2153,2153,180,Former Royal Mint,The grand old Royal Mint building  is now the Hellenic Museum.,-37.812243,144.95672904
2154,2154,180,Flagstaff Gardens,Flagstaff Gardens near the entrance to Flagstaff underground loop station.,-37.81174587,144.95621765
2155,2155,180,Flagstaff Gardens caretaker cottage,Flagstaff Gardens caretaker cottage,-37.80986209,144.95404456
2156,2156,180,City of Melbourne Bowls Club,City of Melbourne Bowls Club,-37.80974657,144.95414873
2157,2157,180,The County Court,"The County Court houses ‘The Lady of Justice’ sculpture by William Eicholtz , which sits above the entrance to the building.",-37.81355582,144.95717313
2158,2158,180,Supreme Court ,The historic Supreme Court at 459-505 Lonsdale St was built between 1874 and 1882 and still in use. ,-37.81360433,144.95745763
2159,2159,180,Waverley Court,Next to the County Court is a 3-storey building formerly known as Waverley Court at 470 Lonsdale St. It was formerly advertised as a place of lodgings in the ‘The Argus’ newspaper on 19 January 1937.,-37.81344295,144.95801904
2160,2160,180,State Public Offices,At 436 Lonsdale is the State Public Offices.,-37.81311929,144.95914484
2161,2161,180,Emporium,Emporium shopping complex ,-37.81183515,144.96357586
2162,2162,181,Tatura court House,"dates back to 1891. Has been used in a number of movies such as ""Till Human Voices Wake Us"" with Helena Bonham Carter.",-36.43997849,145.23255234
2163,2163,181,Private Robert Mactier VC Memorial Gardens,"Named after Robert Mactier, a winner of the Victoria Cross who lost his life in circumstances of extraordinary bravery during WWI",-36.43997619,145.23188707
2164,2164,181,Tutura Hot Bread,Dates back to 1878 and houses a historic oven.,-36.43995101,145.22658738
2165,2165,181,Victory Hall,Opened in 1925 by the then Governer General.,-36.43994447,145.22542812
2166,2166,181,Sacred Heart Parish Curch,Oped 7 august 1889. Rebuilt at a cost of 9000 pounds in a Romanesque style and blessed in 1912 as it had outgrown the previous building.,-36.43993866,145.22439851
2167,2167,181,Sisters of Mercy Convent,Blessed in June 1941.,-36.43993635,145.22399098
2168,2168,181,St Mary's Church Building,build 1901 with its beuatiful balcony and cast iron work.,-36.4399332,145.22343251
2169,2169,181,Tatuta Wartime Camps Museum,Home to a plethora of artefacts depicting the history of the camps in the Tatura/ Murchison area from WWII.,-36.43992957,145.22278911
2170,2170,182,Bridge,Across the Bridge (near the Chinese Garden),-37.08908876,143.47163676
2171,2171,182,River View,River awaiting more rain,-37.08600583,143.4710026
2172,2172,182,Park,Park with toilet block.,-37.09054053,143.47229776
2173,2173,182,Skate Park,Track and Skate Park,-37.0876799,143.47178383
2174,2174,182,Track under the Bridge,Walk under bridge to playground,-37.08982031,143.47168852
2175,2175,182,Chinese Garden,Take a stroll in the Garden,-37.08863143,143.4724819
2176,2176,182,Wild Life,You might spot some wild life in and around the river,-37.09104605,143.47231662
2177,2177,182,River views,River views along the walk,-37.09055777,143.47177616
2178,2178,183,Black Rock Clock Tower,This 4 faced clock and brick tower was built in 1959 and still keeps the time today.,-37.97548336,145.01592904
2179,2179,183,Playground and picnic area,"The playground has a nautical theme of course! There are picnic tables, BBQ's and toilets here also.
",-37.97579204,145.01548111
2180,2180,183,Path to walled walk and beach,Take this path down to the beach.  There are several other options also.,-37.9758597,145.01523435
2181,2181,183,The bluestone sea wall, The sea wall was developed to protect Beach Road.  Sections have been built using original bluestone from the Old  Melbourne Gaol. The inscriptions on stones are still visible.  ,-37.97728896,145.01603901
2182,2182,183,Ricketts Point Marine Sanctuary,A special place to snorkel and see schools of fish and other marine creatures.  Be amazed at what lives just below the surface!   ,-37.97841374,145.01669347
2183,2183,183,Swans and pelicans,"There are often swans and pelicans at this spot.  If they are not there, they are probably further along at Rickets Point.",-37.98173724,145.01818478
2184,2184,183,Quiet corner beach and picnic area.,The wall ends here at this peaceful beach.  Further along the beach is Rickett's Point.,-37.98242221,145.0201267
2185,2185,183,Coastal walking path,The narrow unsealed coast walking path runs parallel with Beach Road winding its way through coastal heathland with elevated views out over the Bay and beaches to the city.,-37.97685765,145.01582444
2186,2186,183,Rugged beauty of the beach landscape,"With the water on one side and the natural vegetation hiding the road on the other, the is nothing to disturb the peace!",-37.98564405,145.02369404
2187,2187,183,Stairway between road and beach,Another access point to the beach.,-37.98811319,145.02755642
2188,2188,183,Wonderful rock pools,"The rocks are covered with green and red algae which shelters a range of invertebrates including brittle stars, bristle worms and crustaceans.",-37.99418421,145.03148317
2189,2189,184,Jetty ,Begin with a walk out on this jetty near the Warneet boat ramp.,-38.22726153,145.30673618
2190,2190,184,Pelicans!,Western Port is recognised as a 'wetland of international importance' under an international treaty called the Ramsar Convention so local and international birds can be seen here.  ,-38.22721514,145.30663196
2191,2191,184,Warneet coastline from the jetty,Looking back at the Warneet Motor Yacht Club and boat ramp.,-38.2271617,145.30651227
2192,2192,184,Fisherman and fishing boats,"Try your luck at fishing while you are here, you are likely to have some company!",-38.227078,145.30643128
2193,2193,184,Beach,If the tide is out you can walk along the beach for sections of the walk. ,-38.22492339,145.30618429
2194,2194,184,Seat and view,"Take a seat, there are plenty along the way.",-38.22330013,145.30712829
2195,2195,184,Mangroves and rowboat,A local coming ashore from his boat.,-38.22293266,145.3077965
2196,2196,184,Track,The track is flat and well defined.  Pack your hat on the sunny days as it is mostly exposed.  ,-38.2222685,145.30903861
2197,2197,184,Jetty near Warneet North Boat Club,Enjoy the view from this shady picnic area.  ,-38.22156715,145.30990425
2198,2198,184,Picnic area,There are many facilities here to make for a pleasant stop.  Picnic tables and BBQ's and a toilet and shelter shed.  ,-38.22126535,145.31016469
2199,2199,184,Cute bridge,Another opportunity to walk along the beach. ,-38.22111443,145.31040536
2200,2200,184,Enjoying the walk,This walk can be enjoyed by you and your dog!,-38.22106924,145.31108299
2201,2201,184,Picnic area and oval,Another spot for a picnic is by the Warneet reserve.  There are drinking water taps here.,-38.21969757,145.31241775
2202,2202,184,Lookout,Have an elevated view over the coastal vegetation and the Rutherford inlet.,-38.21929032,145.31261412
2203,2203,184,Haven,"You can see why Warneet is a perfect spot for fishing and boating and for our feathered friends to roost, breed and feed!",-38.21919346,145.31264221
2204,2204,184,The end,This is the end of this walk but you can keep going along this marked walk through the Warneet Nature Reserve.,-38.21891027,145.31266294
2205,2205,185,Braybrook & Maidstone Neighbourhood House,This organisation is made up of residents of Braybrook and Maidstone  and surrounding areas who are committed to listening to and representing local people to build a proud community.,-37.78190855,144.85940337
2206,2206,185,"Ash Reserve, also known as Braybrook Reserve",Ash Reserve is a peaceful park tucked away inland from the bustling Ballarat Road. The inviting playground and barbecue makes it a great family spot for weekends or those warm Summer evenings.,-37.78116235,144.85391021
2207,2207,185,1950s house,Don't you love these reminders of 1950s Melbourne in Braybrook? The housing shortage of the 40s and 50s was addressed by the Housing Commission which operated from a large new factory in Holmesglen.,-37.78116235,144.85182881
2208,2208,185,Kinder Smith Reserve,"This lovely green space sports a  new playground with state of the art equipment for young children. The area also offers a new GreenWORKS! Mural, RecWest YMCA activities and Sunshine Football Club.",-37.78413015,144.8501122
2209,2209,185,Caroline Chisholm Catholic College ,This popular co-educational Catholic secondary school offers many examples of contemporary architectural and educational art and design for the school community to enjoy. ,-37.78572424,144.85015512
2210,2210,185,Skewes Street Laneway Mural,As you walk along Skewes Street and through the laneway to the shops you'll be pleasantly surprised by this fresh mural which showcases the creative expertise of some Melbourne artists.,-37.7858758,144.85306397
2211,2211,185,Goodstart Early Learning Centre,"At Goodstart Braybrook, the staff strive to maintain a clean, safe and engaging environment for the children. Goodstart is  a multicultural centre with bilingual staff.
 ",-37.7853236,144.85578842
2212,2212,185,Cao Ðài Vietnamese Temple,"Cao Dai  is a new religious movement founded in Vietnam. It mixes ideas from other religions and was  officially established in the city of Tây Ninh, southern Vietnam in 1926.",-37.78512964,144.85872142
2213,2213,186,Murtoa Pool,"In summer months, the Murtoa pool is a fine place for the kids to play whilst adults may take in a walk",-36.61865126,142.46439739
2214,2214,186,Lake Pier.,There are a couple of places that have piers around the lake.,-36.61963752,142.46511685
2215,2215,186,Band Rotunda and BBQ area,There are many good places for picnics and BBQs and here is a few,-36.61953264,142.46505667
2216,2216,186,View looking South,The Lake is a wonderful place with a few nice views,-36.62051241,142.4657185
2217,2217,186,A nice view,The Lake is wonderful and photogenic,-36.61914146,142.46472547
2218,2218,186,Another view,Across the Lake,-36.6189435,142.46451328
2219,2219,186,The corner,The corner at the pool,-36.61862916,142.46422974
2220,2220,186,The start of the avenue of trees,The start of the avenue of trees that are wonderful for shade in summer,-36.61862706,142.46298391
2221,2221,186,The view along the lake side,The view along the lake side,-36.61859791,142.46357789
2222,2222,186,Seating along the way,There is good seating available on the route,-36.61959481,142.46178373
2223,2223,186,Black Swans,"Keep an eye out for the birdlife at the lake, There are Pelicans, Black Swans, Ducks, Coots, Cormorants etc..",-36.62112037,142.46159758
2224,2224,186,Avenues of Gums,The Avenues of Gums are wonderful,-36.6200611,142.46173969
2225,2225,186,Another Pier,There is another pier to walk on,-36.62273103,142.46162963
2226,2226,186,A view across to the water tower,A view across to the water tower,-36.62310981,142.46163701
2227,2227,186,A few new seats for the walk,A few new seats for the walk,-36.62443965,142.46282415
2228,2228,186,The end of the lake,The southerly end of the lake,-36.62400115,142.46180369
2229,2229,187,The path,The path from the car park is a relatively smooth walk.,-37.148157,142.44873047
2230,2230,187,Wildflowers,In Spring there are lots of different wildflowers.,-37.14825962,142.44933128
2231,2231,187,First seat,"There are a few seats, but this one faces the wrong way away from the view! But you can say hello to other walkers on the path which is nice.",-37.14838148,142.44998306
2232,2232,187,The bridge,The bridge makes for an easy walk.,-37.14838148,142.45037735
2233,2233,187,Cairns,There are many cairns or rock sculptures along this stretch of the walk. ,-37.14841141,142.45126516
2234,2234,187,Rocky outcrop,A beautiful spot to look around for lizards.,-37.14839859,142.45152801
2235,2235,187,More cairns,"There are heaps of cairns around here, maybe stop and build one. If you are with children, they love it here.",-37.14840928,142.45171845
2236,2236,187,Beautiful mosses,If you are lucky you might find some beautiful mosses among the rocks.,-37.14837293,142.45188743
2237,2237,187,Wildflowers,"More wildflowers, when we were here in early November there were heaps!",-37.14861024,142.45352089
2238,2238,187,Bush seats,"There are three seats that someone has cut out of old tree stumps, very creative.",-37.14886251,142.45693266
2239,2239,187,The track,The track gets a little more shelter from some taller trees here. Nice dappled light and look for the odd wallaby.,-37.14894803,142.45762467
2240,2240,187,The lookout,Anticipation as you near the lookout.,-37.14935423,142.45884776
2241,2241,187,The Balconies,"The view is amazing, you could spend the day here!",-37.14947823,142.45876193
2242,2242,188,Merri Street Estuary,Stop at the estuary platform to view the flora and fauna that surrounds the Merri River,-38.39016026,142.47016668
2243,2243,188,Harris Street Entry Point,Beginning of the Trail,-38.38982581,142.47012
2244,2244,188,Lake Pertobe Entry Point,Enter the Rail Trail via Lake Pertobe Trail,-38.39205132,142.47277769
2245,2245,188,Rail Trail,Path is sealed for easy walking and/ or bikeriding,-38.38947312,142.46994481
2246,2246,189,Klings Hill Summit View,Looking back east toward Wodonga,-36.11410073,146.79574635
2247,2247,189,The view to Klings Hill summit.,At this stage the slope is a gentle undulation.,-36.12102048,146.81281154
2248,2248,189,Views back to Huon Hill,Beginning the ascent to Klings Hill.,-36.11750008,146.80474594
2249,2249,189,Looking across to the Indigo Valley,"At this elevation one has a number of vistas to take in, including this view toward Barnawartha and beyond.",-36.1153547,146.79580527
2250,2250,190,Birdlife,Birdlife can be viewed all along the walk,-38.05205905,147.57315438
2251,2251,190,Loch Sport Marina,Enjoy the Marina and perhaps even the Marina Hotel!,-38.04548268,147.58119716
2252,2252,190,Lake Victoria,The walk will take you along the shores of Lake Victoria.,-38.05333587,147.57108326
2253,2253,191,Caravan Park Entry,"Walk through Caravan Park. Please be aware this is share zone with Caravan Park, walking track and cars",-37.44285887,143.38057972
2254,2254,191,Track ,River is a little dry ,-37.44268046,143.38087274
2255,2255,191,Bridge,Entering the Bush,-37.44291201,143.38141835
2256,2256,191,Seating ,Seating is spaced out along this track.,-37.44300076,143.38163583
2257,2257,191,Pier,Pier with some local Ducks awaiting the return of the water,-37.44273761,143.38099707
2258,2258,191,Exercise equipment,There are two stations along track 1,-37.44309317,143.38186227
2259,2259,191,Bridge to Snake Island,Snake Island,-37.44322186,143.38223888
2260,2260,191,Snake Island,Cross back over the bridge to re-join the track,-37.4431664,143.38267434
2261,2261,191,Track ,Track,-37.44357767,143.38210686
2262,2262,191,Water Birds,Some of the local wildlife ,-37.44414379,143.38226795
2263,2263,191,Lake View,Seating along the lake and nice view,-37.44434312,143.38405194
2264,2264,191,Track across the Lake,"Across the Lake, nice when there has be rain",-37.44553235,143.38285025
2265,2265,191,Boat Ramp 1,Boat Ramp ,-37.44149608,143.3851444
2266,2266,191,Wall Acrossing,Across the wall to other side,-37.44087349,143.38540651
2267,2267,191,Bridge home,Bridge to second boat ramp and BBQ area. Start of the walk,-37.43988225,143.38220257
2268,2268,191,BBQ Area,BBQ Area,-37.4410546,143.38126721
2269,2269,192,White Necked Heron,"With lots of wetland along the walk you have a good chance of seeing a Heron or two.  They spend lots of time standing very still, keeping a sharp eye out for frogs, insects and fish.",-37.63619829,145.09870511
2270,2270,192,Echidna,"If you're lucky you might spot an Echidna out looking for ants, termites and other small invertebrates which it captures with its long sticky tongue.",-37.63562468,145.09976755
2271,2271,192,Walk markers,There are a number of markers along the way.  This walk follows sections of two walks - the Morang Wetlands Walk and the Ridge Track.,-37.62966835,145.10260078
2272,2272,192,Sheoak tree,The mat of fallen branchlets under sheoaks prevents the development of undergrowth.  For aboriginal people it was considered a safe place to leave children as snakes are said to avoid these areas.,-37.62894793,145.10351369
2273,2273,192,Kangaroo Apple,"There are lots of Kangaroo Apple trees along the way, a hint of things to come further along the walk.",-37.62869428,145.10384874
2274,2274,192,Beauty on a small scale,The wetlands support beautiful succulents thriving in the shallow waters along the walk.,-37.62708591,145.10699255
2275,2275,192,Park view,The walk meanders through a diverse range of bushland and wetlands.  Along the way you get a real sense of being out in the bush.,-37.6270143,145.10731613
2276,2276,192,Eastern Grey Kangaroos,Eastern grey kangaroos are gregarious and form open-membership groups. The groups are made up of 2-3 females and their offspring with the same number of males of which one is dominant. ,-37.62812531,145.10773372
2277,2277,192,Grasses and Sedges,The wetland areas support a wide variety of native grasses and sedges.  See how many different varieties you can spot along the way.,-37.62829573,145.10796921
2278,2278,192,Wetland view,"One of several small lakes along the walk.  Each one supports a wide variety of birdlife including Black Swans, ducks, Purple Swamphens, Egrets, Grebes and Eurasian Coots.  ",-37.62706114,145.11346089
2279,2279,192,Black Swan and cygnets,"Like other swans, the Black Swan is largely monogamous, pairing for life - there is apparently only a 6% divorce rate!  They also share parenting responsibilities of the cygnets.",-37.62694907,145.11386093
2280,2280,192,Dragonfly,"Dragonflies usually patrol a particular area looking for insects to eat. Mosquitoes, flies and midges are a large part of their diet. This fact alone should endear these delightful creatures to us!",-37.6267213,145.11467392
2281,2281,192,Walking in open bushland,The pathway is a mix of gravel path and some more overgrown pathways like the one in this picture.  Overall the route is quite level.,-37.62586357,145.11306819
2282,2282,192,Eastern Great Egret,"The Great Egret breeds in colonies, and often in association with cormorants, ibises and other egrets.  Their nest is a large platform of sticks, placed in a tree over the water.",-37.62566929,145.11254766
2283,2283,192,Foot bridge,"Though the pathway is mostly quite wide at one point along the route there is a very small footbridge.  If you would rather avoid it, there is an alternative route back to the carpark.",-37.62437906,145.105301
2284,2284,193,Hallam North Road car park,"This car park was first provided in the 1980s, but was much enlarged for the Commonwealth Games in 2006. Sometimes crowded on weekends, it has the only toilets and water on this trip",-37.95455287,145.28354645
2285,2285,193,Down in the valley,"This section of Valley View track is the lowest point on this trip. Watch for mountain bike riders, but also for wildlife in the mornings and evenings",-37.95116892,145.28191566
2286,2286,193,Head of the incline,This landing was once the top of a 1 in 10 tramway incline. A 'powerful engine' once sat here to winch the empty skips back up. What kind of engine? We don't know!,-37.94751409,145.27985573
2287,2287,193,The hidden quarry,"A narrow defile on the right leads into the hidden quarry. This is not visible from the track, though walkers on the Rock Gardens track can look down from above",-37.94379138,145.27762413
2288,2288,193,Tramway cutting,Tramline track does not follow the course of the old tramway at this point. The cutting on the right shows where it went. Cuttings were rare on tramways as being expensive to escavate by hand,-37.94108384,145.27444839
2289,2289,193,Crest reservoir,This reservoir at the crest of the range is long out of use. What was it for? Walk from the north corner slightly west of north across Ridge track...,-37.94020386,145.27290344
